name,email,phone,education,work_experience,linkedin,github,projects,certifications,extra,skills
Blender,aanchal.jain1603@gmail.com,+19492666866,,"[{'company_name': 'University, Hyderabad', 'job_title': 'ENGINEERING (CSE)', 'dates_worked': 'frontend development using React over a period of 2 weeks.', 'additional_info': ['E D U C A T I O N', 'Jawaharlal Nehru Technological', '2018 - 2022', 'BACHELOR OF TECHNOLOGY IN', 'COMPUTER SCIENCE AND']}, {'company_name': 'GPA 7.82/10', 'job_title': 'Improved my skills as a software engineer while working on kernels.', 'dates_worked': 'March 2022 - May 2022', 'additional_info': ['L A N G U A G E S', 'English', 'Hindi', 'Telugu', 'Kinara,Inc', 'Feb 2023 - Present', 'QUANTIZED NEURAL NETWORK OPERATOR DEV']}]",,,,,,"and stay up-to-date with the latest technologies. 
In addition to my
design. I am excited to learn and grow in this area, and I believe that
my passion for both technical and design skills make me a strong
candidate for any team.
P R O F I L E
E X P E R I E N C E
Thoughtworks
May 2022 - December 2022
APPLICATION DEVELOPER INTERN (INNOVATION LAB)
Created a virtual aisle and 3D models using Blender, for a Luxury
Retail Application.
Developed a Skin Analyser ML project which detects skin
conditions of a person and recommends makeup products.
Worked on validation, testing and backend development for
completion of the project.
Worked on a major Metaverse project which involved creating a
3D space of the office and people, motions and gestures of the
avatars using Unity and developed the UI using Blender and the
Adobe Creative Cloud suite.
Thoughtworks
APPLICATION DEVELOPER TRAINEE (PROGRAD) 
Improved my skills as a full stack developer while working on
“Kalavithi” , an art gallery website.
Trained on backend development through Java and Spring Boot,
while working with other interns. Gained hands-on"
