name,email,phone,education,work_experience,linkedin,github,projects,certifications,extra,skills
B2 Certificate,raquelzueco6@gmail.com,+34691070128,"[{'university_name': 'MASTERS IN INTERNATIONAL BUSINESS WITH MODERN \nLANGUAGES University', 'course_name': 'Marketing', 'dates_attended': '2019-2024', 'marks_or_percentage': '', 'additional_info': ['of Strathclyde, Glasgow | 2019-2024 \nSubject Focus: , Human Resource Management, \nInternational Management and French. \nYEAR ABROAD IN FRANCE Toulouse Business School | 2022-2023  \nSubject Focus: Brand Activation, Marketing of Wine, Wine Tourism, \nWine Culture and Image and Video Marketing. \n \n EXPERIENCE \nSOCIAL MEDIA CONTENT CREATOR | Curious Marketing | Sept. \n2021 - May 2022  \nCreated educational and engaging content for a Marketing Consultancy \nstart-up posting on Instagram, Facebook and LinkedIn. Used Canva to \ncreate weekly and monthly content.  \nSEASONAL SALES ASSISTANT | Tienda Solidaria Piel de \nMariposa Patraix | June 2022 - Aug. 2022 \nResponsible for store organization, assisting customers and taking \npayments. Additionally, was in charge of the window exposition design \nand store promotion to existing clients. \nADDITIONAL SKILLS AND EXPERIENCE \nMODEL UN Participated in two Model UN Local Conferences where I \nrepresented the political interests of two different countries. This \nexperience involved taking part in debates, which improved my ability to \ncommunicate ideas clearly and negotiate. \nAIESEC Took part in the initiative for 3 months, in which as part of a \nteam we promoted teaching internships abroad by creating all \nmarketing collateral and promotional stands.  \nFête des Vendanges Participated in the second edition of this event \nin Capitol Square in Toulouse, where we sold wine tasting kits to \nparticipants. Link to an article about the event. \nWine More Time Helped organise a wine tasting event with unusual \nwines from the South-West region, where we had to contact and secure \nrare wine varieties ourselves from commercial wine suppliers.  \nMaster Level Programme South of France Have attained this \ncertification demonstrating my knowledge of the wines in the Languedoc \n- Roussillon region equivalent to 2-3 level of WSET (Wine Spirit \nEducation Trust in London). Link here.']}]","[{'company_name': 'SPANISH Mother Tongue', 'job_title': '', 'dates_worked': 'Tel.: +34 691070128', 'additional_info': ['countries and learning to embrace', 'diverse cultures.', 'CONTACT INFORMATION', '350 Cathedral Street, G2 1BQ,', 'Glasgow', 'Email: raquelzueco6@gmail.com', 'LANGUAGES', 'ENGLISH Fluent Written and', 'Spoken (Level C2/Proficiency)', 'FRENCH Good Command, Written', 'and Spoken (B2 Certificate, lived a', 'year in France)']}]",,,,,"MUSIC ABRSM Piano exam Level 3 
and Music Theory Level 3. 
Performed in numerous recitals. 
TRAVEL Organised a city tour 
experience as part of Travel and 
Tourism course. Have completed 
over 500km in hikes through Spain 
and travel abroad often.  
ART Took over 10 years of art 
classes, developing","watercolour, oil paint and pencil."
