name,email,phone,education,work_experience,linkedin,github,projects,certifications,extra,skills
Pitta Vikash,vikashpitta@gmail.com,,"[{'university_name': 'Ongoing\nIndustry Ready Certification in Full Stack Development\nKakinada Institute', 'course_name': 'B.Tech', 'dates_attended': '2015 - 2019', 'marks_or_percentage': '07%', 'additional_info': ['of Engineering & Technologies, Kakinada\n2015 - 2019\n (Electronics & Communication Engineering) [66.07%]']}, {'university_name': 'Krishna Sai Junior College', 'course_name': 'mediate', 'dates_attended': '2012 - 2014', 'marks_or_percentage': '7%', 'additional_info': [', Sompeta\n2012 - 2014\nInter (MPC) [91.7%]']}]",,,,"Portfolio-Project
Developed a responsive website for the Portfolio of a person where other people like interviewers can
see a list of projects, skills, testimonials, contact info
 
Designed page by using HTML structure elements and by using different bootstrap components to
show different sections in the website and different Bootstrap classes for responsiveness through the
mobile-first approach.
 
Displayed testimonials from different people using bootstrap carousel components.
Technologies used: HTML, CSS, Bootstrap
https://vick1portfolio.ccbp.tech/#
E-Commerce-Project
Developed an E-Commerce website where users can go through different products, detailed information about
a product offers, and contact us info.
 
Designed page using following HTML structure elements and footer elements by using different
bootstrap components to show different sections in the website and different bootstrap classes for
responsiveness through the mobile-first approach.
 
Implemented product youtube videos by using bootstrap embed and model components and displayed
multiple images of offers in a carousel using a bootstrap carousel.
Technologies used: HTML, CSS, Bootstrap
https://vikakaecommerce.ccbp.tech/
VR-Project
Developed a responsive website for VR products where users can see a list of products, detailed information
about a product and trending blogs, contact us info
 
Designed page using HTML structure elements, footer elements by using different bootstrap
components to show different sections in the website.
 
Implemented responsiveness by using Bootstrap grid system and flex classes and CSS box model
properties through a mobile-first approach.
Technologies used: HTML, CSS, Bootstrap
https://vickyvirtualpge.ccbp.tech
Achievements
 
Completed NCC along with my graduation in the Air Wing.
 
Created an impact on the public by participating in awareness rallies.",,,"Front End: HTML, CSS, Bootstrap, JavaScript, React.js*
Back End: Python, Express*, Node.js*
Databases: SQLite, MongoDB*
*courses yet to be complete."
