name,email,phone,education,work_experience,linkedin,github,projects,certifications,extra,skills
Jaipur,sravya.undavalli11@gmail.com,+19256906088,"[{'university_name': 'Manipal University', 'course_name': 'mance', 'dates_attended': '2017 - 2018', 'marks_or_percentage': '', 'additional_info': ['Jaipur\nEnrolled in computer science and engineering with a strong academic \nperfor, maintaining a CGPA of 8.73. Anticipated completion of Program by \n2024.\n2020 - 2024\nJaipur, Rajasthan\nHigh school diploma\nSasi junior college\nCompleted intermediate education with a remarkable CGPA of 9.84. Specialized in \nMathematics, Physics, and Chemistry (MPC) subjects.\n2018 - 2020\nEluru\nSecondary school of education\nSasi English Medium school\nAchieved a perfect cumulative grade point average (CGPA) of 10.00\n2017 - 2018\nEluru, Andhrapradesh']}]","[{'company_name': 'Celebal Technologies', 'job_title': 'Data Engineer Trainee Intern', 'dates_worked': '05/2023 - 07/2023', 'additional_info': ['role.']}]",,,"Monkey pox detection using Deep learning
Accomplished deep learning professional in developing and implementing CNN image recognition models for 
monkeypox virus detection. leveraging advanced convolutional neural networks to accurately identify and 
classify monkeypox virus images, contributing to effective disease control strategies. Demonstrated expertise 
in image processing and delivering impactful results.
Bank loan status prediction using machine learning
Experienced machine learning practitioner adept at utilizing random forest algorithms for bank loan status 
prediction. 
Online library management system
Online library management system is a comprehensive web-based solution designed to streamline and 
automate library operations. It enables efficient management of library resources, including book cataloging, 
user management, borrowing and returning books, reservation management, fine calculation, and reporting. 
software engineering project which includes Unified modelling language.
Weather forecast using React
Weather forecast application developed using React, providing users with real-time weather information and 
forecasts. The application leverages React's component-based architecture to deliver an interactive and 
responsive user interface.
SKILLS
Python
Proficient in Python programming language, with experience in developing scalable and efficient 
applications. Skilled in utilizing Python libraries and frameworks for various purposes, data analysis (NumPy, 
Pandas).
Machine Learning
Strong understanding of machine learning concepts and algorithms. Experience in developing and 
implementing machine learning models for tasks such as classification, regression, and clustering. Familiarity 
with popular machine learning libraries like TensorFlow.
Deep Learning
Proficient in deep learning techniques and frameworks, with a strong understanding of neural networks and 
their architectures. Skilled in designing and training deep learning models for various tasks, such as image 
classification, object detection, and natural language processing. Experienced in working with popular deep 
learning libraries like TensorFlow. Convolutional Neural Networks In-depth knowledge of CNNs, a powerful 
class of deep learning models widely used for computer vision tasks. Experienced in applying CNNs for tasks 
such as image recognition and feature extraction.
Web Development
Front-End Development: Good front-end web development, with expertise in HTML, CSS, and JavaScript. 
Skilled in creating interactive and user-friendly web interfaces using modern web standards and best 
practices. 
JavaScript Frameworks/Libraries:  working with JavaScript frameworks and libraries such as React. 
Back-End Development: Familiarity with back-end development concepts and technologies, including server-
side programming languages like Node.js.
Flutter
Good in Flutter, a cross-platform framework for building mobile applications. Android and iOS platforms 
using Flutter's reactive UI framework. 
Dart: knowledge of the Dart programming language, which is the primary language used for Flutter 
development.
MySQL
Knowledge of MySQL database management system, including database design, querying, and optimization.
Microsoft Azure Cloud
Familiarity with Microsoft Azure cloud platform and services.
C Language",,content writing | Travel | Reading,"Excels in fast-paced environments and thrives on challenges that require creative thinking. Seeking an
opportunity to apply academic knowledge and gain practical"
